{
  "run_id": "F26-developer-F26-T02-20260607-084245",
  "feature": "F26",
  "task": "F26-T02",
  "role": "developer",
  "updated_at": "2026-06-07T11:43:52Z",
  "task_progress": "unknown",
  "last_tool_result": "XPjUZHKHC3aZUGbs8r5G3mId/fkCexRORlRKg6HBW47E0vn9L5Dx/5kj64gjbwn+mVzEwzT9RYSfZVKES2EE+25f3s4Xq8HUYqwmKKpUaSYreO/TQ4fI83rVvOfSzr3dEVMvQFDLUJ+KtfJwRtA4UuvzqEdeMX5gsD4SoLSsVJbeYF/ZW3eDJ4P3409tl+RCCH+XU8kXtzjc1D6gHFHdWFL98/O1/N5zMkchiCCasmkG7itCMhW4nEaYSOXBf28nWA7L8sB4OFReH8waP9sgQoqiPQyirz/niGcxLnXkUQ/ygKQVCO329HWZUpS4X/cqrnoHTjg5H4SCeeJwCaHFq8CfpfHA3bP9VAaGXYikpi5OV0CICq5gu02SdCGhxnnRdxXAIMyMC3deuFk7tSOoD/v9HksQAbRK4b4552RgB\"}],\"stop_reason\":null,\"stop_sequence\":null,\"stop_details\":null,\"usage\":{\"input_tokens\":2,\"cache_creation_input_tokens\":4903,\"cache_read_input_tokens\":34438,\"cache_creation\":{\"ephemeral_5m_input_tokens\":0,\"ephemeral_1h_input_tokens\":4903},\"output_tokens\":3,\"service_tier\":\"standard\",\"inference_geo\":\"not_available\"},\"diagnostics\":null,\"context_management\":null},\"parent_tool_use_id\":null,\"session_id\":\"0ebaa692-104f-4546-9f68-67c5a2ec2d82\",\"uuid\":\"1296f84f-1a48-4e5f-945f-2b1902cc6043\",\"request_id\":\"req_011CboqetE2SG8TRMiXH2GVW\"}\n{\"type\":\"assistant\",\"message\":{\"model\":\"claude-sonnet-4-6\",\"id\":\"msg_01HDNWvsVWRdH347ceCHjfAk\",\"type\":\"message\",\"role\":\"assistant\",\"content\":[{\"type\":\"tool_use\",\"id\":\"toolu_01LogKs7hUq9p9yGhe5g2gHo\",\"name\":\"Bash\",\"input\":{\"command\":\"which mmdc npx 2>/dev/null; npx -y @mermaid-js/mermaid-cli -i docs/diagrams/F26-architecture.mmd -o /tmp/f26-arch.svg 2>&1 | tail -30; echo \\\"---\\\"; npx -y @mermaid-js/mermaid-cli -i docs/diagrams/F26-journey.mmd -o /tmp/f26-journey.svg 2>&1 | tail -30\"},\"caller\":{\"type\":\"direct\"}}],\"stop_reason\":null,\"stop_sequence\":null,\"stop_details\":null,\"usage\":{\"input_tokens\":2,\"cache_creation_input_tokens\":4903,\"cache_read_input_tokens\":34438,\"cache_creation\":{\"ephemeral_5m_input_tokens\":0,\"ephemeral_1h_input_tokens\":4903},\"output_tokens\":3,\"service_tier\":\"standard\",\"inference_geo\":\"not_available\"},\"diagnostics\":null,\"context_management\":null},\"parent_tool_use_id\":null,\"session_id\":\"0ebaa692-104f-4546-9f68-67c5a2ec2d82\",\"uuid\":\"cbff7faf-65b1-4c3a-8103-2f86b08f5149\",\"request_id\":\"req_011CboqetE2SG8TRMiXH2GVW\"}\n",
  "todo_state": [],
  "context_summary": "",
  "next_action_hint": ""
}
