{
  "run_id": "F25-developer-F25-T04-20260606-055623",
  "feature": "F25",
  "task": "F25-T04",
  "role": "developer",
  "updated_at": "2026-06-06T08:57:32Z",
  "task_progress": "unknown",
  "last_tool_result": "       new_hook_commands.append(hook)\\n                    # else: remove by not appending\\n                elif \\\"{{DIDIO_HOME}}\\\" in cmd:\\n                    hook = dict(hook)\\n                    hook[\\\"command\\\"] = cmd.replace(\\\"{{DIDIO_HOME}}\\\", DIDIO_HOME_REPLACEMENT)\\n                    new_hook_commands.append(hook)\\n                else:\\n                    new_hook_commands.append(hook)\\n\\n            if new_hook_commands:\\n                handler = dict(handler)\\n                handler[\\\"hooks\\\"] = new_hook_commands\\n                new_handlers.append(handler)\\n            # else: drop empty handler block\\n\\n        settings[\\\"hooks\\\"][event_name] = new_handlers\\n\\n    return settings\\n\\nfor proj, is_second_brain in PROJECTS:\\n    path = f\\\"{BASE}/{proj}/.claude/settings.json\\\"\\n    with open(path) as f:\\n        settings = json.load(f)\\n\\n    # Validate before\\n    before_count = json.dumps(settings).count(\\\"{{\\\")\\n    \\n    settings = fix_settings(settings, is_second_brain)\\n    \\n    after_count = json.dumps(settings).count(\\\"{{\\\")\\n\\n    # Validate JSON is still valid by serialising\\n    out = json.dumps(settings, indent=2)\\n    json.loads(out)  # re-parse to confirm valid\\n\\n    with open(path, \\\"w\\\") as f:\\n        f.write(out + \\\"\\\\n\\\")\\n\\n    print(f\\\"{proj}: {{{{ before={before_count}, after={after_count}}}}}\\\")\\n\\nPY\",\"description\":\"Run Python script to fix hooks in all 7 downstream projects\"},\"caller\":{\"type\":\"direct\"}}],\"stop_reason\":null,\"stop_sequence\":null,\"stop_details\":null,\"usage\":{\"input_tokens\":1,\"cache_creation_input_tokens\":2655,\"cache_read_input_tokens\":30788,\"cache_creation\":{\"ephemeral_5m_input_tokens\":0,\"ephemeral_1h_input_tokens\":2655},\"output_tokens\":19,\"service_tier\":\"standard\",\"inference_geo\":\"not_available\"},\"diagnostics\":null,\"context_management\":null},\"parent_tool_use_id\":null,\"session_id\":\"00dadaf0-a2fb-46e8-b1de-237f4e8ee8ba\",\"uuid\":\"8e7fe7a1-879b-4287-abca-23e68a1155eb\",\"request_id\":\"req_011CbmjB1Pe1RA1jb1JCAgfu\"}\n",
  "todo_state": [],
  "context_summary": "",
  "next_action_hint": ""
}
