{
  "run_id": "F26-developer-F26-T09-20260607-085940",
  "feature": "F26",
  "task": "F26-T09",
  "role": "developer",
  "updated_at": "2026-06-07T11:59:45Z",
  "task_progress": "unknown",
  "last_tool_result": "pe\":\"assistant\",\"message\":{\"model\":\"claude-sonnet-4-6\",\"id\":\"msg_01B4RchPKtC2UM3SenwphpoC\",\"type\":\"message\",\"role\":\"assistant\",\"content\":[{\"type\":\"thinking\",\"thinking\":\" I'll start by examining the relevant files to understand what we're working with.\",\"signature\":\"Eu4BCmgIDhgCKkASJE6rWfUASO05nht67DBS1CAmtvfhTY1wlP2Phxm2hFxTn+5foo9jwaw+Qp/i0ARG3zzRddNfwRZoJSpEcknNMhRjbGF1ZGUtZjhkMmQ0ZjYtcHJvZDgAQgh0aGlua2luZxIMMFZqqD9VzWGYGGIXGgyRBYTzrY2WgZwRgiQiMFNpZDxn54x7Penqxt4vBIpbs2e86mK8sbU6oFMVI5ARHZHkLqeZuMwggR+mgk8VXCo0Bvt7EYRlL6lsPo357Urc+L1w+INinGagruPRhiE+FOhy/PRGYcZDcZX3GV2qzbgvx4dDLxgB\"}],\"stop_reason\":null,\"stop_sequence\":null,\"stop_details\":null,\"usage\":{\"input_tokens\":2,\"cache_creation_input_tokens\":14998,\"cache_read_input_tokens\":18231,\"cache_creation\":{\"ephemeral_5m_input_tokens\":0,\"ephemeral_1h_input_tokens\":14998},\"output_tokens\":3,\"service_tier\":\"standard\",\"inference_geo\":\"not_available\"},\"diagnostics\":null,\"context_management\":null},\"parent_tool_use_id\":null,\"session_id\":\"5f0c2f14-e383-4e70-b3c7-d09f32249bcf\",\"uuid\":\"82e530cf-c721-4dbe-b143-28c928d8100b\",\"request_id\":\"req_011Cborw1EmH9cL4mi4uVS79\"}\n{\"type\":\"assistant\",\"message\":{\"model\":\"claude-sonnet-4-6\",\"id\":\"msg_01B4RchPKtC2UM3SenwphpoC\",\"type\":\"message\",\"role\":\"assistant\",\"content\":[{\"type\":\"tool_use\",\"id\":\"toolu_01K7Aks3K1tS1pP7MMGT12vQ\",\"name\":\"Read\",\"input\":{\"file_path\":\"/Users/eduardodidio/claude-didio-config/patterns/hooks/feature-end-digest/hook.sh\"},\"caller\":{\"type\":\"direct\"}}],\"stop_reason\":null,\"stop_sequence\":null,\"stop_details\":null,\"usage\":{\"input_tokens\":2,\"cache_creation_input_tokens\":14998,\"cache_read_input_tokens\":18231,\"cache_creation\":{\"ephemeral_5m_input_tokens\":0,\"ephemeral_1h_input_tokens\":14998},\"output_tokens\":3,\"service_tier\":\"standard\",\"inference_geo\":\"not_available\"},\"diagnostics\":null,\"context_management\":null},\"parent_tool_use_id\":null,\"session_id\":\"5f0c2f14-e383-4e70-b3c7-d09f32249bcf\",\"uuid\":\"120c6ff6-ed88-429b-9e0f-1e1a6292733b\",\"request_id\":\"req_011Cborw1EmH9cL4mi4uVS79\"}\n",
  "todo_state": [],
  "context_summary": "",
  "next_action_hint": ""
}
