{
  "run_id": "F26-developer-F26-T08-20260607-084535",
  "feature": "F26",
  "task": "F26-T08",
  "role": "developer",
  "updated_at": "2026-06-07T11:47:56Z",
  "task_progress": "unknown",
  "last_tool_result": "ict | Class | Fix task |\\n|---|---------|-------|---------|-------|----------|\\n| 2a | Stop (digest) hook absent from `templates/.claude/settings.json` \u2192 downstream never gets learning digests | `templates/.claude/settings.json` (`hooks`, lines 31-54) | CONFIRMED | IMPORTANT | T10 |\\n| 2b | `templates/.claude/settings.highlander.json` has no `hooks` block at all (0 of Pre/Post/Stop wired) | `templates/.claude/settings.highlander.json` | CONFIRMED | IMPORTANT | T10 |\\n| 2c | Path-token divergence (`$CLAUDE_PROJECT_DIR` upstream vs `${DIDIO_HOME:-$HOME/.claude-didio-config}` template/highlander) is correct by design \u2014 upstream repo IS the framework home, downstream is not | upstream vs template (`audit/eval/06-settings.md`) | CONFIRMED-INTENTIONAL | VERIFIED-OK (document) | \u2014 (T08 doc, no fix) |\\n| 3a | Hardcoded `/Users/eduardodidio/didio-second-brain-claude/mcp-server/src/index.ts` MCP path (second-brain hub repo, not this repo; breaks on any other machine/user) | `.claude/settings.json:43` | CONFIRMED | IMPORTANT | T10 |\\n| F25-fix | `placeholder-settings.json` confirmed negative fixture (consumed only by `bin/tests/F25-integration.sh` as a deliberately dirty sync-source input; never live-loaded); `clean-project-stub/.claude/settings.json` confirmed clean (no `{{...}}`, no hardcoded paths, matches template convention) | `tests/F25-fixtures/` (`audit/eval/06-settings.md`) | CONFIRMED | VERIFIED-OK | \u2014 (record only) |\\n\"},\"caller\":{\"type\":\"direct\"}}],\"stop_reason\":null,\"stop_sequence\":null,\"stop_details\":null,\"usage\":{\"input_tokens\":2,\"cache_creation_input_tokens\":464,\"cache_read_input_tokens\":58738,\"cache_creation\":{\"ephemeral_5m_input_tokens\":0,\"ephemeral_1h_input_tokens\":464},\"output_tokens\":38,\"service_tier\":\"standard\",\"inference_geo\":\"not_available\"},\"diagnostics\":null,\"context_management\":null},\"parent_tool_use_id\":null,\"session_id\":\"c79b51c0-694d-449f-8d49-cbcfb833adde\",\"uuid\":\"dfe8dbe2-2f91-42ad-acbd-232ed06249d9\",\"request_id\":\"req_011Cbor26ptYYLMRHpHL91Zp\"}\n",
  "todo_state": [],
  "context_summary": "",
  "next_action_hint": ""
}
