{
  "run_id": "F25-techlead-F25-README-20260606-055952",
  "feature": "F25",
  "task": "F25-README",
  "role": "techlead",
  "updated_at": "2026-06-06T09:06:11Z",
  "task_progress": "unknown",
  "last_tool_result": "n- **Role(s) affected:** developer, techlead\\n- **Lesson:** For any downstream-cleanup task that translates `{{X}}` \u2192 resolved value: first collect existing commands into a set, then skip if the resolved value is already present. Never blindly append without dedup-checking the destination.\\n\\n---\\n\\n- **Pattern:** `bin/tests/F25-unit.sh` was specified in the test plan but never created. This is the 4th+ instance of a test script listed in a test plan not existing (F09, F13, F15 all had similar gaps). The test plan is currently treated as aspirational rather than contractual.\\n- **Role(s) affected:** developer, techlead, qa\\n- **Lesson:** Any test harness path listed in `<FXX>-test-plan.md` under a named harness section is a required deliverable. TechLead should verify existence of every named harness file before approving (`ls bin/tests/F25-*.sh` or equivalent). Missing \u2192 BLOCKING, not IMPORTANT.\\n\\n---\\n\\n- **Pattern:** Two second-brain repos (`didio-second-brain-claude`, `didio-second-brain-clean-starter`) had distinct pre-existing states from previous eras. A blanket cleanup script that doesn't introspect pre-existing state before acting will make these projects worse, not better.\\n- **Role(s) affected:** developer\\n- **Lesson:** For repos with non-standard pre-existing state, always `diff` before-after in the commit for manual review. Use `git diff HEAD` as a sanity check step before committing each downstream.\\n\"},\"caller\":{\"type\":\"direct\"}}],\"stop_reason\":null,\"stop_sequence\":null,\"stop_details\":null,\"usage\":{\"input_tokens\":1,\"cache_creation_input_tokens\":3058,\"cache_read_input_tokens\":65806,\"cache_creation\":{\"ephemeral_5m_input_tokens\":0,\"ephemeral_1h_input_tokens\":3058},\"output_tokens\":45,\"service_tier\":\"standard\",\"inference_geo\":\"not_available\"},\"diagnostics\":null,\"context_management\":null},\"parent_tool_use_id\":null,\"session_id\":\"b30d5b6b-a42e-4615-bfec-d244d9417b65\",\"uuid\":\"0f51a342-a5c3-4861-b797-802d7175f3f4\",\"request_id\":\"req_011CbmjoKDTK2n9n6JLR284j\"}\n",
  "todo_state": [],
  "context_summary": "",
  "next_action_hint": ""
}
