{
  "run_id": "F26-techlead-F26-README-20260607-084448",
  "feature": "F26",
  "task": "F26-README",
  "role": "techlead",
  "updated_at": "2026-06-07T11:44:53Z",
  "task_progress": "unknown",
  "last_tool_result": "ctory to find the relevant files.\",\"signature\":\"EpoDCmgIDhgCKkAce56sf3j5+nCS3PWvp++fV3awn+puKm2d8pJinH/9ZkhQxyA0pjkqYTC62zffJ49usJzHIQHywIL9BQenHMPkMhRjbGF1ZGUtZjhkMmQ0ZjYtcHJvZDgAQgh0aGlua2luZxIMKDROwTnFaVTbRfG3GgzhXFrGcwB2ntme6gciMMw3A59IQdBxK7vt6yAncNk6pQLRpMm3ike5wTmCoFx0S48AP+vbymVt/ssKLovtaSrfAX6PTMmhdzhn/30D3Ko76ak+FBpS/xQCai0EjSeV6RPN1ykixefuJ5uYI3h3TLbgV8XGTGZGTR+jE/US3HwiH+SDcpRPUm+2vHNQ0CW0ktpKQuAZcqLdZTciEYpbcDppImVgjmZr5PsN3LYlM//iXm0bBCTBLcoclYKlnVAriXDxat044vcT2aQ/IFSdwf98rgwGulLKj5SiDXDsKI6Lg+vZOVYlGk12aoRrebdS13E/Iu7NysS+5EXeSOzu7jMhKcb5QbD/ddeVKIUEK0WSLGYLcqMZx09lROVnaL1RNmsYAQ==\"}],\"stop_reason\":null,\"stop_sequence\":null,\"stop_details\":null,\"usage\":{\"input_tokens\":2,\"cache_creation_input_tokens\":15610,\"cache_read_input_tokens\":18231,\"cache_creation\":{\"ephemeral_5m_input_tokens\":0,\"ephemeral_1h_input_tokens\":15610},\"output_tokens\":2,\"service_tier\":\"standard\",\"inference_geo\":\"not_available\"},\"diagnostics\":null,\"context_management\":null},\"parent_tool_use_id\":null,\"session_id\":\"07fd05df-edd6-4237-90d3-fe60fd548e0b\",\"uuid\":\"305d4ed0-da9e-4b90-9cc6-ff83b576baf2\",\"request_id\":\"req_011CboqoD6oi5LXGvCgHK9UG\"}\n{\"type\":\"assistant\",\"message\":{\"model\":\"claude-sonnet-4-6\",\"id\":\"msg_01P7aPpv2v5myV6q374fa6S2\",\"type\":\"message\",\"role\":\"assistant\",\"content\":[{\"type\":\"tool_use\",\"id\":\"toolu_01Ay6xGTebrf4n2L2ptZMpw1\",\"name\":\"Bash\",\"input\":{\"command\":\"ls /Users/eduardodidio/claude-didio-config/tasks/features/ | grep F26\"},\"caller\":{\"type\":\"direct\"}}],\"stop_reason\":null,\"stop_sequence\":null,\"stop_details\":null,\"usage\":{\"input_tokens\":2,\"cache_creation_input_tokens\":15610,\"cache_read_input_tokens\":18231,\"cache_creation\":{\"ephemeral_5m_input_tokens\":0,\"ephemeral_1h_input_tokens\":15610},\"output_tokens\":2,\"service_tier\":\"standard\",\"inference_geo\":\"not_available\"},\"diagnostics\":null,\"context_management\":null},\"parent_tool_use_id\":null,\"session_id\":\"07fd05df-edd6-4237-90d3-fe60fd548e0b\",\"uuid\":\"68cdc474-935c-48e4-8384-48c2691f758b\",\"request_id\":\"req_011CboqoD6oi5LXGvCgHK9UG\"}\n",
  "todo_state": [],
  "context_summary": "",
  "next_action_hint": ""
}
