{
  "run_id": "F25-tea-F25-README-20260606-051002",
  "feature": "F25",
  "task": "F25-README",
  "role": "tea",
  "updated_at": "2026-06-06T08:11:08Z",
  "task_progress": "unknown",
  "last_tool_result": "riginalFile\":null,\"userModified\":false}}\n{\"type\":\"assistant\",\"message\":{\"model\":\"claude-sonnet-4-6\",\"id\":\"msg_01X3xZsYKp53NWw87A6WndZR\",\"type\":\"message\",\"role\":\"assistant\",\"content\":[{\"type\":\"text\",\"text\":\"Now appending the test plan annotation to each task file with a `## Test scenarios` section.\"}],\"stop_reason\":null,\"stop_sequence\":null,\"stop_details\":null,\"usage\":{\"input_tokens\":1,\"cache_creation_input_tokens\":2785,\"cache_read_input_tokens\":33514,\"cache_creation\":{\"ephemeral_5m_input_tokens\":0,\"ephemeral_1h_input_tokens\":2785},\"output_tokens\":1,\"service_tier\":\"standard\",\"inference_geo\":\"not_available\"},\"diagnostics\":null,\"context_management\":null},\"parent_tool_use_id\":null,\"session_id\":\"757154c0-8921-4958-b5b2-2a08bc79424f\",\"uuid\":\"8b299c28-f5b1-467f-921e-9f1991090c26\",\"request_id\":\"req_011CbmfgtSohX7eAJ5hKC9GL\"}\n{\"type\":\"assistant\",\"message\":{\"model\":\"claude-sonnet-4-6\",\"id\":\"msg_01X3xZsYKp53NWw87A6WndZR\",\"type\":\"message\",\"role\":\"assistant\",\"content\":[{\"type\":\"tool_use\",\"id\":\"toolu_01Mz1Darv2g6hMH3xYRT3xcT\",\"name\":\"Edit\",\"input\":{\"replace_all\":false,\"file_path\":\"/Users/eduardodidio/claude-didio-config/tasks/features/F25-hooks-fix/F25-T01.md\",\"old_string\":\"- **Error scenario:** script ausente \u2192 hook falha graciosamente (n\u00e3o bloqueia sess\u00e3o).\",\"new_string\":\"- **Error scenario:** script ausente \u2192 hook falha graciosamente (n\u00e3o bloqueia sess\u00e3o).\\n\\n**Test plan:** ver `F25-test-plan.md` (fixtures: placeholder-settings)\"},\"caller\":{\"type\":\"direct\"}}],\"stop_reason\":null,\"stop_sequence\":null,\"stop_details\":null,\"usage\":{\"input_tokens\":1,\"cache_creation_input_tokens\":2785,\"cache_read_input_tokens\":33514,\"cache_creation\":{\"ephemeral_5m_input_tokens\":0,\"ephemeral_1h_input_tokens\":2785},\"output_tokens\":1,\"service_tier\":\"standard\",\"inference_geo\":\"not_available\"},\"diagnostics\":null,\"context_management\":null},\"parent_tool_use_id\":null,\"session_id\":\"757154c0-8921-4958-b5b2-2a08bc79424f\",\"uuid\":\"e20722e9-4011-4f58-aa92-635799a4a25f\",\"request_id\":\"req_011CbmfgtSohX7eAJ5hKC9GL\"}\n",
  "todo_state": [],
  "context_summary": "",
  "next_action_hint": ""
}
