{
  "run_id": "F26-architect-F26-_tmp-brief-20260606-070638",
  "feature": "F26",
  "task": "F26-_tmp-brief",
  "role": "architect",
  "updated_at": "2026-06-06T10:11:10Z",
  "task_progress": "unknown",
  "last_tool_result": ", the `if [ -f ]` guard\\nis false, the whole block is skipped, and `registry_match` is **never called**.\\nThe registry gate is therefore a **silent no-op** \u2014 the digest is gated only by\\nthe Status:done + recent-QA checks, not by any project-registry allowlist the\\ngate was meant to enforce. `load-env.sh` (hub env loading) is likewise never\\nloaded. Today this \\\"degrades safe\\\" (hook still runs and drops digests) but the\\nintended registry scoping is absent.\\n\\n### Audit / fix decision needed\\n\\nTwo valid resolutions (the fix task must pick one and document why):\\n- **(A) Remove** the two dead `source` blocks if registry scoping is no longer\\n  desired \u2192 hook becomes honest about what it gates on.\\n- **(B) Create** `_lib/load-env.sh` + `_lib/registry-match.sh` with the\\n  intended behavior if registry scoping IS desired downstream.\\n\\nPer architect learning F09: every criterion in a user-facing gate must have a\\nmatching code check, or be removed \u2014 don't leave aspirational/dead gates.\\n\\n## `patterns/hooks/_lib/digest-context.sh`\\n\\nProvides `emit_drop_payload`. Present and sourced correctly. Audit: confirm it\\nexits non-fatally and the drop file is non-empty (`hook.sh` rm's empty drops).\\n\\n## `patterns/hooks/feature-end-digest/test-hook.sh`\\n\\nExisting test harness for the digest hook. Audit: confirm it still passes and\\nwhether it would have caught the missing-`_lib` regression (it didn't \u2014\\ntest-gap to note).\\n\"},\"caller\":{\"type\":\"direct\"}}],\"stop_reason\":null,\"stop_sequence\":null,\"stop_details\":null,\"usage\":{\"input_tokens\":131,\"cache_creation_input_tokens\":3013,\"cache_read_input_tokens\":66776,\"cache_creation\":{\"ephemeral_5m_input_tokens\":0,\"ephemeral_1h_input_tokens\":3013},\"output_tokens\":62,\"service_tier\":\"standard\",\"inference_geo\":\"not_available\"},\"diagnostics\":null,\"context_management\":null},\"parent_tool_use_id\":null,\"session_id\":\"122e45e3-cac8-4b43-aee4-f545e0fb74c5\",\"uuid\":\"641a6e86-46e5-44f4-a12a-a91bffd86b68\",\"request_id\":\"req_011CbmpppJY88rZzMeEQAS7F\"}\n",
  "todo_state": [],
  "context_summary": "",
  "next_action_hint": ""
}
