{
  "run_id": "F09-readiness-F09-README-20260426-093614",
  "feature": "F09",
  "task": "F09-README",
  "role": "readiness",
  "updated_at": "2026-04-26T12:40:49Z",
  "task_progress": "unknown",
  "last_tool_result": " the file (referenced by T04) |\\n| `archive/README.md` | PASS | yes | T01 creates the file (referenced by T04, T02 --help) |\\n| `docs/F09-scan-exclusion-check.md` with Decision | PASS | yes | T01 creates and fills it; T03 reads Decision to choose Branch A/B |\\n| `.gitignore` updated with archive/ + claude-didio-out/ | PASS | yes | T01 appends both entries; T03 smoke validates presence |\\n\\n## Check 5 \u2014 Testing section non-empty\\n\\n| Task | Status | Detail |\\n|------|--------|--------|\\n| T01  | PASS   | \u22654 lines; cites `git status --porcelain`, `cat .gitignore`, `mmdc` |\\n| T02  | PASS   | \u22655 lines; cites `bash tests/F09-archive-script.sh`, git fixtures, mktemp |\\n| T03  | PASS   | \u22655 lines; cites `bash tests/F09-scan-exclusion.sh`, python3 JSON validator |\\n| T04  | PASS   | \u22654 lines; cites `LC_ALL=C grep`, `git diff README.md` |\\n| T05  | PASS   | \u22654 lines; cites `bash -n bin/didio-sync-project.sh`, awk heredoc parse |\\n| T06  | PASS   | \u22654 lines; cites `test -d`, `bash tests/F09-archive-script.sh` |\\n| T07  | PASS   | \u22653 lines; cites `LC_ALL=C grep`, `git branch`, `ls logs/agents/F99-*` |\\n| T08  | PASS   | \u22653 lines; cites `LC_ALL=C grep` on sync dry-run log |\\n| T09  | PASS   | Wave 4 techlead \u2014 meta task exception applies |\\n| T10  | PASS   | Wave 4 QA \u2014 meta task exception applies |\\n| T11  | PASS   | \u22653 lines; cites `LC_ALL=C grep -ncE`, `LC_ALL=C grep -nF \\\"F09\\\" memory/agent-learnings/*.md` |\\n\\n## Summary\\n- PASS: 5\\n- FAIL: 0\\n\\n**Verdict:** READY\\n\"},\"caller\":{\"type\":\"direct\"}}],\"stop_reason\":null,\"stop_sequence\":null,\"stop_details\":null,\"usage\":{\"input_tokens\":1,\"cache_creation_input_tokens\":5302,\"cache_read_input_tokens\":67900,\"cache_creation\":{\"ephemeral_5m_input_tokens\":0,\"ephemeral_1h_input_tokens\":5302},\"output_tokens\":10,\"service_tier\":\"standard\",\"inference_geo\":\"not_available\"},\"diagnostics\":null,\"context_management\":null},\"parent_tool_use_id\":null,\"session_id\":\"3df6babf-db01-4b53-9a9a-b9b9147ba5f0\",\"uuid\":\"76512f5f-8413-45d1-94eb-00212c3a4221\"}\n",
  "todo_state": [],
  "context_summary": "",
  "next_action_hint": ""
}
