{
  "run_id": "F26-developer-F26-T11-20260607-085940",
  "feature": "F26",
  "task": "F26-T11",
  "role": "developer",
  "updated_at": "2026-06-07T11:59:45Z",
  "task_progress": "unknown",
  "last_tool_result": "578d1117d7\"}\n{\"type\":\"assistant\",\"message\":{\"model\":\"claude-sonnet-4-6\",\"id\":\"msg_01Ld5pB2UzMStpnSBjxehno3\",\"type\":\"message\",\"role\":\"assistant\",\"content\":[{\"type\":\"thinking\",\"thinking\":\" Looking at the file now.\",\"signature\":\"Eu4BCmgIDhgCKkDs5O2aqRvFJg299GXN+sEwOP0VlHjvzc3ZU3i1Pm8dZCp5Qh2F8hRYoEJSXs6qe9LInAHHUiw/ImBzfjCzn6/dMhRjbGF1ZGUtZjhkMmQ0ZjYtcHJvZDgAQgh0aGlua2luZxIMT8lTpdsruOSMw4m3GgxWNhvV55FHu+VvZSIiMDWIaUfpXhVyebt573oozLY/MIGXxDz2qSGbBduDmaBhM/46oFnz3VLOkbBDSEk13So0TakptVMIlQKOU+lb+OkOvQAbM0LxTzRUEg20G89Otq2xvZxa2HL6TOB4GzKZxIj7s7356xgB\"}],\"stop_reason\":null,\"stop_sequence\":null,\"stop_details\":null,\"usage\":{\"input_tokens\":2,\"cache_creation_input_tokens\":14784,\"cache_read_input_tokens\":18231,\"cache_creation\":{\"ephemeral_5m_input_tokens\":0,\"ephemeral_1h_input_tokens\":14784},\"output_tokens\":5,\"service_tier\":\"standard\",\"inference_geo\":\"not_available\"},\"diagnostics\":null,\"context_management\":null},\"parent_tool_use_id\":null,\"session_id\":\"64abd334-3501-42b8-bbe2-f3578d1117d7\",\"uuid\":\"da64c562-e154-4161-8241-44643a5e1555\",\"request_id\":\"req_011Cborw1SfWtz3rwD32w9yh\"}\n{\"type\":\"assistant\",\"message\":{\"model\":\"claude-sonnet-4-6\",\"id\":\"msg_01Ld5pB2UzMStpnSBjxehno3\",\"type\":\"message\",\"role\":\"assistant\",\"content\":[{\"type\":\"tool_use\",\"id\":\"toolu_01FMVsxvkdCxHsge3so8jSLY\",\"name\":\"Bash\",\"input\":{\"command\":\"grep -n \\\"DIDIO_HOME\\\\|config-lib\\\\|/Users/eduardodidio\\\" /Users/eduardodidio/claude-didio-config/bin/didio-budget-probe.sh\"},\"caller\":{\"type\":\"direct\"}}],\"stop_reason\":null,\"stop_sequence\":null,\"stop_details\":null,\"usage\":{\"input_tokens\":2,\"cache_creation_input_tokens\":14784,\"cache_read_input_tokens\":18231,\"cache_creation\":{\"ephemeral_5m_input_tokens\":0,\"ephemeral_1h_input_tokens\":14784},\"output_tokens\":5,\"service_tier\":\"standard\",\"inference_geo\":\"not_available\"},\"diagnostics\":null,\"context_management\":null},\"parent_tool_use_id\":null,\"session_id\":\"64abd334-3501-42b8-bbe2-f3578d1117d7\",\"uuid\":\"70721bf3-bb49-449b-a2fc-2f18791d97b2\",\"request_id\":\"req_011Cborw1SfWtz3rwD32w9yh\"}\n",
  "todo_state": [],
  "context_summary": "",
  "next_action_hint": ""
}
