{
  "run_id": "F26-developer-F26-T07-20260607-085737",
  "feature": "F26",
  "task": "F26-T07",
  "role": "developer",
  "updated_at": "2026-06-07T11:57:43Z",
  "task_progress": "unknown",
  "last_tool_result": "kpvxS+RY1gW5VuA3JPZtg721D8c2ceZwIVGMmdgP4DSbpV9ySzUWEgGcpEx3VugHaB9kdq3AX1IaosMhRjbGF1ZGUtZjhkMmQ0ZjYtcHJvZDgAQgh0aGlua2luZxIMDaKoBb9s9usFBMyQGgxjRQxvX9l0lkwhM/EiMMPDlXDjdRTW2caI+bZml6Jy0reyFKdz8LjrI8KEBQvUeqbW7v9F2ibx2/n+16ApIyqDAr6tfgitYhgdOrlcRArMB5G7cvnlZZDbDJxSpWE2y2XPGv07zKJY6HcWBJOsJO1u1+17BZ+zLlZuHSdbeCyyneG8SkJfeK/ZzRp1l3DE7FQR1WYDICywnYUS9Lgcc/Gi8zKPnfBBQB9b5om+IX87bwfXBIryrR6+wi4RDo46kmYYOZ1k/hc4hQQ2WVRYyTnjdwIojW7Ttabn4VntzciCBCCX6Trj/lXmjHx2Dys2LYjZI1uXqKox5pLOZkD3gKK4SuSoe/j623jnrmBxXMMlpUS9YglOKhQUmnFqgg1V1+oWEv2VpR1jVtCPHer05tItRffXSfskaOgKULnjbgghM8LRBmsYAQ==\"}],\"stop_reason\":null,\"stop_sequence\":null,\"stop_details\":null,\"usage\":{\"input_tokens\":2,\"cache_creation_input_tokens\":15085,\"cache_read_input_tokens\":18231,\"cache_creation\":{\"ephemeral_5m_input_tokens\":0,\"ephemeral_1h_input_tokens\":15085},\"output_tokens\":3,\"service_tier\":\"standard\",\"inference_geo\":\"not_available\"},\"diagnostics\":null,\"context_management\":null},\"parent_tool_use_id\":null,\"session_id\":\"bbff3385-f7de-43fd-8622-3270cb407e29\",\"uuid\":\"91b42bd5-d26a-4426-a860-7145a82153f8\",\"request_id\":\"req_011Cbormw3FdfR1vuGQsWRn7\"}\n{\"type\":\"assistant\",\"message\":{\"model\":\"claude-sonnet-4-6\",\"id\":\"msg_01VPJ1q444mW22BU52p38Cvg\",\"type\":\"message\",\"role\":\"assistant\",\"content\":[{\"type\":\"tool_use\",\"id\":\"toolu_01Lpa5yza6bdjY8wbKZP4fyV\",\"name\":\"Bash\",\"input\":{\"command\":\"ls -la audit/eval/ 2>/dev/null; cat audit/eval/05-resume-pending.md 2>/dev/null | head -100\"},\"caller\":{\"type\":\"direct\"}}],\"stop_reason\":null,\"stop_sequence\":null,\"stop_details\":null,\"usage\":{\"input_tokens\":2,\"cache_creation_input_tokens\":15085,\"cache_read_input_tokens\":18231,\"cache_creation\":{\"ephemeral_5m_input_tokens\":0,\"ephemeral_1h_input_tokens\":15085},\"output_tokens\":3,\"service_tier\":\"standard\",\"inference_geo\":\"not_available\"},\"diagnostics\":null,\"context_management\":null},\"parent_tool_use_id\":null,\"session_id\":\"bbff3385-f7de-43fd-8622-3270cb407e29\",\"uuid\":\"c3bc62e6-d773-4768-93fb-0ee8598ae150\",\"request_id\":\"req_011Cbormw3FdfR1vuGQsWRn7\"}\n",
  "todo_state": [],
  "context_summary": "",
  "next_action_hint": ""
}
