{
  "run_id": "F26-developer-F26-T12-20260607-133100",
  "feature": "F26",
  "task": "F26-T12",
  "role": "developer",
  "updated_at": "2026-06-07T16:32:07Z",
  "task_progress": "unknown",
  "last_tool_result": "ove) \u2014 a missing\",\"+`python3` degrades observability, not safety. Operators on a machine without\",\"+`python3` should expect the guard to be effectively inert (silent allow on\",\"+every call) rather than seeing errors.\",\"+\",\"+---\",\"+\",\" ## Gaps a corrigir (Wave 2)\",\" \",\" ### Gap #1 (AC1/AC2): ccusage command mismatch \u2014 `FAIL` mandat\u00f3rio\"]}],\"userModified\":false,\"replaceAll\":false}}\n{\"type\":\"assistant\",\"message\":{\"model\":\"claude-sonnet-4-6\",\"id\":\"msg_01CGXMAtTgRwUwksZZySGXdL\",\"type\":\"message\",\"role\":\"assistant\",\"content\":[{\"type\":\"text\",\"text\":\"Now let's add the optional one-line comment in `didio-post-tool.sh` (no Wave-2 collision there).\"}],\"stop_reason\":null,\"stop_sequence\":null,\"stop_details\":null,\"usage\":{\"input_tokens\":2,\"cache_creation_input_tokens\":859,\"cache_read_input_tokens\":46783,\"cache_creation\":{\"ephemeral_5m_input_tokens\":0,\"ephemeral_1h_input_tokens\":859},\"output_tokens\":2,\"service_tier\":\"standard\",\"inference_geo\":\"not_available\"},\"diagnostics\":null,\"context_management\":null},\"parent_tool_use_id\":null,\"session_id\":\"e560058d-accc-49c1-b1e5-48e5fdfeb7a2\",\"uuid\":\"3859a149-f3b8-496d-b7a8-1d28c8a6c9aa\",\"request_id\":\"req_011CbpDhiWmaXbZgFEghVXjW\"}\n{\"type\":\"assistant\",\"message\":{\"model\":\"claude-sonnet-4-6\",\"id\":\"msg_01CGXMAtTgRwUwksZZySGXdL\",\"type\":\"message\",\"role\":\"assistant\",\"content\":[{\"type\":\"tool_use\",\"id\":\"toolu_014CQTYLvm2pJRGHPM27ciJq\",\"name\":\"Bash\",\"input\":{\"command\":\"head -25 bin/hooks/didio-post-tool.sh\"},\"caller\":{\"type\":\"direct\"}}],\"stop_reason\":null,\"stop_sequence\":null,\"stop_details\":null,\"usage\":{\"input_tokens\":2,\"cache_creation_input_tokens\":859,\"cache_read_input_tokens\":46783,\"cache_creation\":{\"ephemeral_5m_input_tokens\":0,\"ephemeral_1h_input_tokens\":859},\"output_tokens\":2,\"service_tier\":\"standard\",\"inference_geo\":\"not_available\"},\"diagnostics\":null,\"context_management\":null},\"parent_tool_use_id\":null,\"session_id\":\"e560058d-accc-49c1-b1e5-48e5fdfeb7a2\",\"uuid\":\"f047e921-37a1-42c5-afca-8a6e9bc47289\",\"request_id\":\"req_011CbpDhiWmaXbZgFEghVXjW\"}\n",
  "todo_state": [],
  "context_summary": "",
  "next_action_hint": ""
}
