{
  "run_id": "F99-developer-F99-T02-deny-20260427-092515",
  "feature": "F99",
  "task": "F99-T02-deny",
  "role": "developer",
  "updated_at": "2026-04-27T12:25:32Z",
  "task_progress": "unknown",
  "last_tool_result": "gHxjjGAE=\"}],\"stop_reason\":null,\"stop_sequence\":null,\"stop_details\":null,\"usage\":{\"input_tokens\":3,\"cache_creation_input_tokens\":10181,\"cache_read_input_tokens\":11634,\"cache_creation\":{\"ephemeral_5m_input_tokens\":0,\"ephemeral_1h_input_tokens\":10181},\"output_tokens\":1,\"service_tier\":\"standard\",\"inference_geo\":\"not_available\"},\"context_management\":null},\"parent_tool_use_id\":null,\"session_id\":\"0e4e76ed-0cf3-4f49-a0c8-35e6e578a299\",\"uuid\":\"fa3e8a64-83ed-49c2-9320-c763977478c4\"}\n{\"type\":\"assistant\",\"message\":{\"model\":\"claude-sonnet-4-6\",\"id\":\"msg_01AevTUaSc4PZ5XMdsVv97dz\",\"type\":\"message\",\"role\":\"assistant\",\"content\":[{\"type\":\"text\",\"text\":\"I'll attempt to edit `.claude/settings.json` as instructed, expecting the edit to be denied.\"}],\"stop_reason\":null,\"stop_sequence\":null,\"stop_details\":null,\"usage\":{\"input_tokens\":3,\"cache_creation_input_tokens\":10181,\"cache_read_input_tokens\":11634,\"cache_creation\":{\"ephemeral_5m_input_tokens\":0,\"ephemeral_1h_input_tokens\":10181},\"output_tokens\":1,\"service_tier\":\"standard\",\"inference_geo\":\"not_available\"},\"context_management\":null},\"parent_tool_use_id\":null,\"session_id\":\"0e4e76ed-0cf3-4f49-a0c8-35e6e578a299\",\"uuid\":\"52a157d2-2c4a-4e5d-af37-ed2f80447bf5\"}\n{\"type\":\"assistant\",\"message\":{\"model\":\"claude-sonnet-4-6\",\"id\":\"msg_01AevTUaSc4PZ5XMdsVv97dz\",\"type\":\"message\",\"role\":\"assistant\",\"content\":[{\"type\":\"tool_use\",\"id\":\"toolu_013QEDiE8eZq86SPVr7fK1bK\",\"name\":\"Read\",\"input\":{\"file_path\":\"/Users/eduardodidio/claude-didio-config/.claude/settings.json\"},\"caller\":{\"type\":\"direct\"}}],\"stop_reason\":null,\"stop_sequence\":null,\"stop_details\":null,\"usage\":{\"input_tokens\":3,\"cache_creation_input_tokens\":10181,\"cache_read_input_tokens\":11634,\"cache_creation\":{\"ephemeral_5m_input_tokens\":0,\"ephemeral_1h_input_tokens\":10181},\"output_tokens\":1,\"service_tier\":\"standard\",\"inference_geo\":\"not_available\"},\"context_management\":null},\"parent_tool_use_id\":null,\"session_id\":\"0e4e76ed-0cf3-4f49-a0c8-35e6e578a299\",\"uuid\":\"2b52484a-ab4a-45f2-8e48-c4f099394348\"}\n",
  "todo_state": [],
  "context_summary": "",
  "next_action_hint": ""
}
