{
  "run_id": "F25-developer-F25-T03-20260606-051446",
  "feature": "F25",
  "task": "F25-T03",
  "role": "developer",
  "updated_at": "2026-06-06T08:17:00Z",
  "task_progress": "unknown",
  "last_tool_result": "claude-didio-config/tasks/features/F25-sync-placeholder-guard/F25-T03.md\",\"limit\":5},\"caller\":{\"type\":\"direct\"}}],\"stop_reason\":null,\"stop_sequence\":null,\"stop_details\":null,\"usage\":{\"input_tokens\":1,\"cache_creation_input_tokens\":2428,\"cache_read_input_tokens\":33307,\"cache_creation\":{\"ephemeral_5m_input_tokens\":0,\"ephemeral_1h_input_tokens\":2428},\"output_tokens\":2,\"service_tier\":\"standard\",\"inference_geo\":\"not_available\"},\"diagnostics\":null,\"context_management\":null},\"parent_tool_use_id\":null,\"session_id\":\"2dec5adf-e9b4-4f98-a342-af14cdb53230\",\"uuid\":\"f7311043-ae4d-4575-ad81-940642f93e07\",\"request_id\":\"req_011Cbmg8jGd5zp1psM8SK1jj\"}\n{\"type\":\"user\",\"message\":{\"role\":\"user\",\"content\":[{\"type\":\"tool_result\",\"content\":\"File does not exist. Note: your current working directory is /Users/eduardodidio/claude-didio-config.\",\"is_error\":true,\"tool_use_id\":\"toolu_01BkSBch2Vdsady2WhyqgxQw\"}]},\"parent_tool_use_id\":null,\"session_id\":\"2dec5adf-e9b4-4f98-a342-af14cdb53230\",\"uuid\":\"87ad26a2-1cb6-4818-bebc-34c727e2aa4c\",\"timestamp\":\"2026-06-06T08:16:57.439Z\",\"tool_use_result\":\"Error: File does not exist. Note: your current working directory is /Users/eduardodidio/claude-didio-config.\"}\n{\"type\":\"assistant\",\"message\":{\"model\":\"claude-sonnet-4-6\",\"id\":\"msg_0165To5eGWQMpXoGPw4sY6c7\",\"type\":\"message\",\"role\":\"assistant\",\"content\":[{\"type\":\"tool_use\",\"id\":\"toolu_01THq9JxqWMsgAJW5gfBRybs\",\"name\":\"Glob\",\"input\":{\"pattern\":\"tasks/features/F25*/**\"},\"caller\":{\"type\":\"direct\"}}],\"stop_reason\":null,\"stop_sequence\":null,\"stop_details\":null,\"usage\":{\"input_tokens\":1,\"cache_creation_input_tokens\":170,\"cache_read_input_tokens\":35735,\"cache_creation\":{\"ephemeral_5m_input_tokens\":0,\"ephemeral_1h_input_tokens\":170},\"output_tokens\":50,\"service_tier\":\"standard\",\"inference_geo\":\"not_available\"},\"diagnostics\":null,\"context_management\":null},\"parent_tool_use_id\":null,\"session_id\":\"2dec5adf-e9b4-4f98-a342-af14cdb53230\",\"uuid\":\"546ec373-dad5-4a29-85ee-5ec26ee0aa19\",\"request_id\":\"req_011Cbmg8yaqzq7z5qJ9EzAY7\"}\n",
  "todo_state": [],
  "context_summary": "",
  "next_action_hint": ""
}
