{
  "run_id": "F25-developer-F25-T02-20260606-051200",
  "feature": "F25",
  "task": "F25-T02",
  "role": "developer",
  "updated_at": "2026-06-06T08:14:20Z",
  "task_progress": "unknown",
  "last_tool_result": "_1h_input_tokens\":233},\"output_tokens\":59,\"service_tier\":\"standard\",\"inference_geo\":\"not_available\"},\"diagnostics\":null,\"context_management\":null},\"parent_tool_use_id\":null,\"session_id\":\"5bb51832-83b7-427f-9477-d71838c4cbf8\",\"uuid\":\"e65d75c7-54b4-475e-ba60-375ab1ccc3a3\",\"request_id\":\"req_011CbmfvTfgXcSNYAWBfMLCG\"}\n{\"type\":\"user\",\"message\":{\"role\":\"user\",\"content\":[{\"tool_use_id\":\"toolu_018udNfTQMK3kKZLQ4VRefgx\",\"type\":\"tool_result\",\"content\":\"1\\t# Task F25-T02 \u2014 Sanear settings.json do upstream (dogfood)\\n2\\t\\n3\\t**Feature:** F25\\n4\\t**Wave:** 0\\n5\\t**Type:** infra\"}]},\"parent_tool_use_id\":null,\"session_id\":\"5bb51832-83b7-427f-9477-d71838c4cbf8\",\"uuid\":\"09b3f0b3-737c-4ae5-9f14-1795ef7ea883\",\"timestamp\":\"2026-06-06T08:14:14.614Z\",\"tool_use_result\":{\"type\":\"text\",\"file\":{\"filePath\":\"/Users/eduardodidio/claude-didio-config/tasks/features/F25-hooks-fix/F25-T02.md\",\"content\":\"# Task F25-T02 \u2014 Sanear settings.json do upstream (dogfood)\\n\\n**Feature:** F25\\n**Wave:** 0\\n**Type:** infra\",\"numLines\":5,\"startLine\":1,\"totalLines\":58}}}\n{\"type\":\"assistant\",\"message\":{\"model\":\"claude-sonnet-4-6\",\"id\":\"msg_01LgsTqaEPYTCddH8Vtqe6ST\",\"type\":\"message\",\"role\":\"assistant\",\"content\":[{\"type\":\"tool_use\",\"id\":\"toolu_01J3yJ1UiVCUwsF84A9vAJ48\",\"name\":\"Edit\",\"input\":{\"replace_all\":false,\"file_path\":\"/Users/eduardodidio/claude-didio-config/tasks/features/F25-hooks-fix/F25-T02.md\",\"old_string\":\"**Status:** planned\",\"new_string\":\"**Status:** done\"},\"caller\":{\"type\":\"direct\"}}],\"stop_reason\":null,\"stop_sequence\":null,\"stop_details\":null,\"usage\":{\"input_tokens\":1,\"cache_creation_input_tokens\":166,\"cache_read_input_tokens\":31793,\"cache_creation\":{\"ephemeral_5m_input_tokens\":0,\"ephemeral_1h_input_tokens\":166},\"output_tokens\":63,\"service_tier\":\"standard\",\"inference_geo\":\"not_available\"},\"diagnostics\":null,\"context_management\":null},\"parent_tool_use_id\":null,\"session_id\":\"5bb51832-83b7-427f-9477-d71838c4cbf8\",\"uuid\":\"96add6fb-dee5-49b0-ad41-dc93935e99df\",\"request_id\":\"req_011CbmfvyYHCPPiB4rEiTgry\"}\n",
  "todo_state": [],
  "context_summary": "",
  "next_action_hint": ""
}
