{
  "run_id": "F26-developer-F26-T06-20260607-084535",
  "feature": "F26",
  "task": "F26-T06",
  "role": "developer",
  "updated_at": "2026-06-07T11:47:40Z",
  "task_progress": "unknown",
  "last_tool_result": "ays false) |\\n| `emit_drop_payload` non-fatal, drop file non-empty | **CONFIRMED** |\\n| `test-hook.sh` result | **FAIL \u2014 4/8 (exit=1)**, root cause = missing `fixtures/` dir (pre-existing, unrelated to finding 1) |\\n| Test-gap: does `test-hook.sh` assert `_lib` presence? | **No** \u2014 would not have caught the regression; flagged for T09 |\\n\",\"structuredPatch\":[],\"originalFile\":null,\"userModified\":false}}\n{\"type\":\"assistant\",\"message\":{\"model\":\"claude-sonnet-4-6\",\"id\":\"msg_013kYaG9Eemyz7JAR64L3n8J\",\"type\":\"message\",\"role\":\"assistant\",\"content\":[{\"type\":\"text\",\"text\":\"Now let me update the task file with `Status: done`.\"}],\"stop_reason\":null,\"stop_sequence\":null,\"stop_details\":null,\"usage\":{\"input_tokens\":2,\"cache_creation_input_tokens\":3598,\"cache_read_input_tokens\":51887,\"cache_creation\":{\"ephemeral_5m_input_tokens\":0,\"ephemeral_1h_input_tokens\":3598},\"output_tokens\":2,\"service_tier\":\"standard\",\"inference_geo\":\"not_available\"},\"diagnostics\":null,\"context_management\":null},\"parent_tool_use_id\":null,\"session_id\":\"6e1088d2-d693-4a98-a8c5-412811984ab0\",\"uuid\":\"dd78f2d4-50c9-4125-b320-948185756008\",\"request_id\":\"req_011Cbor1gmHc9cnz5wRwX2cH\"}\n{\"type\":\"assistant\",\"message\":{\"model\":\"claude-sonnet-4-6\",\"id\":\"msg_013kYaG9Eemyz7JAR64L3n8J\",\"type\":\"message\",\"role\":\"assistant\",\"content\":[{\"type\":\"tool_use\",\"id\":\"toolu_01RAaANqv7PHXdmYFfYMtNHt\",\"name\":\"Bash\",\"input\":{\"command\":\"head -10 \\\"tasks/features/F26-hooks-audit/F26-T06.md\\\"\"},\"caller\":{\"type\":\"direct\"}}],\"stop_reason\":null,\"stop_sequence\":null,\"stop_details\":null,\"usage\":{\"input_tokens\":2,\"cache_creation_input_tokens\":3598,\"cache_read_input_tokens\":51887,\"cache_creation\":{\"ephemeral_5m_input_tokens\":0,\"ephemeral_1h_input_tokens\":3598},\"output_tokens\":2,\"service_tier\":\"standard\",\"inference_geo\":\"not_available\"},\"diagnostics\":null,\"context_management\":null},\"parent_tool_use_id\":null,\"session_id\":\"6e1088d2-d693-4a98-a8c5-412811984ab0\",\"uuid\":\"4bfbdc34-9ff3-4617-bdcc-c8cca05a1c1c\",\"request_id\":\"req_011Cbor1gmHc9cnz5wRwX2cH\"}\n",
  "todo_state": [],
  "context_summary": "",
  "next_action_hint": ""
}
