{
  "run_id": "F26-developer-F26-T12-20260607-085940",
  "feature": "F26",
  "task": "F26-T12",
  "role": "developer",
  "updated_at": "2026-06-07T11:59:46Z",
  "task_progress": "unknown",
  "last_tool_result": " reviewing the relevant brief files and understanding how the hook documentation is structured.\",\"signature\":\"EqECCmgIDhgCKkAesjUCaiW7s7AoMl0yJGg2t2uWlMKjwl/g/Jz0smhUVNiRl/hpN86xO+BFZ3uTkeRfvhsSNXnjphPWOpmV9x6hMhRjbGF1ZGUtZjhkMmQ0ZjYtcHJvZDgAQgh0aGlua2luZxIM50085Utv0N5+leGRGgy18zV9Tgo+e89QDYciMHIdjEukeYF5wvBKVi7nXnkDqEWeT5+nlrCLlIOt/9g49IkTAYO6zHRYv3jvpA7DmSpnWExKeJTjMp0Etax5rRNzQkWCu/9asNNRyvNhmugVw0g5M4HkidfU9Eepu3HJLACdPqznD9g/zae3OmYrEuAKN9Izm5FYTdQCdfSAWqRpMvB/v7/m/fk0EDgt6oKeu3szbJNYVnWQcBgB\"}],\"stop_reason\":null,\"stop_sequence\":null,\"stop_details\":null,\"usage\":{\"input_tokens\":2,\"cache_creation_input_tokens\":14700,\"cache_read_input_tokens\":18231,\"cache_creation\":{\"ephemeral_5m_input_tokens\":0,\"ephemeral_1h_input_tokens\":14700},\"output_tokens\":3,\"service_tier\":\"standard\",\"inference_geo\":\"not_available\"},\"diagnostics\":null,\"context_management\":null},\"parent_tool_use_id\":null,\"session_id\":\"dc3df4c4-5c15-4359-a165-a3a4380dd10f\",\"uuid\":\"f53fa8fd-72ed-401e-91c3-9bb195b0d42c\",\"request_id\":\"req_011Cborw3EKH6yoVVPBwC1w5\"}\n{\"type\":\"assistant\",\"message\":{\"model\":\"claude-sonnet-4-6\",\"id\":\"msg_01RRQsrYr4Zib73VWarzpaTj\",\"type\":\"message\",\"role\":\"assistant\",\"content\":[{\"type\":\"tool_use\",\"id\":\"toolu_013p6U1S5DmAZ4UUT22DE1Jn\",\"name\":\"Bash\",\"input\":{\"command\":\"find /Users/eduardodidio/claude-didio-config/tasks/features -maxdepth 1 -iname \\\"F26*\\\"; ls /Users/eduardodidio/claude-didio-config/tasks/features/F26*/_brief/ 2>/dev/null\"},\"caller\":{\"type\":\"direct\"}}],\"stop_reason\":null,\"stop_sequence\":null,\"stop_details\":null,\"usage\":{\"input_tokens\":2,\"cache_creation_input_tokens\":14700,\"cache_read_input_tokens\":18231,\"cache_creation\":{\"ephemeral_5m_input_tokens\":0,\"ephemeral_1h_input_tokens\":14700},\"output_tokens\":3,\"service_tier\":\"standard\",\"inference_geo\":\"not_available\"},\"diagnostics\":null,\"context_management\":null},\"parent_tool_use_id\":null,\"session_id\":\"dc3df4c4-5c15-4359-a165-a3a4380dd10f\",\"uuid\":\"b9cee13a-b1c6-4b69-a58a-f31580dbdfa6\",\"request_id\":\"req_011Cborw3EKH6yoVVPBwC1w5\"}\n",
  "todo_state": [],
  "context_summary": "",
  "next_action_hint": ""
}
