{
  "run_id": "F26-developer-F26-T11-20260607-133100",
  "feature": "F26",
  "task": "F26-T11",
  "role": "developer",
  "updated_at": "2026-06-07T16:31:06Z",
  "task_progress": "unknown",
  "last_tool_result": "\"message\",\"role\":\"assistant\",\"content\":[{\"type\":\"thinking\",\"thinking\":\" I'm checking the current file state and looking at how home resolution is handled in other parts of the codebase.\",\"signature\":\"EqECCmgIDhgCKkD2bu+GHTTNWWYPQcyh0/yXeKIfHoTM29nRIJgHgZpO6jkqm1U4tT6StGNZ4oq5smOvhbOwLO9wL1Ln7NMymAC5MhRjbGF1ZGUtZjhkMmQ0ZjYtcHJvZDgAQgh0aGlua2luZxIMkM9iYouy6sOGK1b1GgyGCvSaR53cBnvxPrIiMCy0AGfZSFggvz6u+P8aibvQM+S2moghVXoLCzpua1qBWQi2qylCAHS2t+RVrLRGtSpn5RGwtuxgTqQMNB2VpsjRY7BXAMm8fi5UMz7sYBvE/Jfs3VCKv3imzfZhouP6bw0fPkMPum7jIwjrMaveM7mDxNetY/PNJ1PqqB+xFCcnHuhmoZQSVJKEplugi5IH3wcwhg7FxDPKMhgB\"}],\"stop_reason\":null,\"stop_sequence\":null,\"stop_details\":null,\"usage\":{\"input_tokens\":2,\"cache_creation_input_tokens\":32903,\"cache_read_input_tokens\":0,\"cache_creation\":{\"ephemeral_5m_input_tokens\":0,\"ephemeral_1h_input_tokens\":32903},\"output_tokens\":3,\"service_tier\":\"standard\",\"inference_geo\":\"not_available\"},\"diagnostics\":null,\"context_management\":null},\"parent_tool_use_id\":null,\"session_id\":\"51c40d38-fdaa-47e8-8279-07a5183e4095\",\"uuid\":\"06d3e0fa-7a86-42b1-92a2-2baf48c77c41\",\"request_id\":\"req_011CbpDd6oa4rmzVKWUWSr1F\"}\n{\"type\":\"assistant\",\"message\":{\"model\":\"claude-sonnet-4-6\",\"id\":\"msg_01UxC4GhHWFSekxmbjJ5fZRC\",\"type\":\"message\",\"role\":\"assistant\",\"content\":[{\"type\":\"tool_use\",\"id\":\"toolu_01Ftrwk5rxpBqXmuQwKBcCBP\",\"name\":\"Bash\",\"input\":{\"command\":\"cat -n /Users/eduardodidio/claude-didio-config/bin/didio-budget-probe.sh | sed -n '1,70p'\"},\"caller\":{\"type\":\"direct\"}}],\"stop_reason\":null,\"stop_sequence\":null,\"stop_details\":null,\"usage\":{\"input_tokens\":2,\"cache_creation_input_tokens\":32903,\"cache_read_input_tokens\":0,\"cache_creation\":{\"ephemeral_5m_input_tokens\":0,\"ephemeral_1h_input_tokens\":32903},\"output_tokens\":3,\"service_tier\":\"standard\",\"inference_geo\":\"not_available\"},\"diagnostics\":null,\"context_management\":null},\"parent_tool_use_id\":null,\"session_id\":\"51c40d38-fdaa-47e8-8279-07a5183e4095\",\"uuid\":\"840e1b7f-2834-4579-97c0-d40ea53fd3a0\",\"request_id\":\"req_011CbpDd6oa4rmzVKWUWSr1F\"}\n",
  "todo_state": [],
  "context_summary": "",
  "next_action_hint": ""
}
